{
  "component": {
    "implementation": "current local interpreter",
    "interface": "math.expm1",
    "project": "python-stdlib"
  },
  "contract_id": "stdlib-expm1-execution-demo-v1",
  "domain": {
    "dtype": "binary64",
    "inputs": [
      0.125,
      0.5
    ]
  },
  "execution": {
    "deterministic": true,
    "device": "cpu"
  },
  "references": {
    "analytic_derivative": true,
    "independent_path": "50-digit decimal exponential"
  },
  "relations": {
    "central_derivative": {
      "comparator": "analytic_exponential_derivative",
      "generator": "centered_difference",
      "layer": "property",
      "max_invocations": 4,
      "mechanisms": [
        "derivative_error"
      ],
      "parameters": {
        "absolute_tolerance": 1e-07,
        "step": 1e-05
      }
    },
    "decimal_value": {
      "comparator": "decimal_exponential_difference",
      "generator": "constant_demo_points",
      "layer": "reference",
      "max_invocations": 2,
      "mechanisms": [
        "value_error"
      ],
      "parameters": {
        "absolute_tolerance": 0.001
      }
    }
  },
  "schema": "P4-Component-Contract-v1"
}
