{
  "schema": "P4-Component-Contract-v1",
  "contract_id": "pytorch-masked-select-gradient-v1",
  "component": {"project": "pytorch/pytorch", "interface": "torch.masked_select backward", "implementation": "released wheel"},
  "domain": {"inputs": "finite non-contiguous convolution outputs and broadcast masks", "parameters": {"batch": [3], "time": [4], "features": [5]}},
  "execution": {"deterministic": true, "dtypes": ["float32"], "devices": ["cpu"], "seed": 42},
  "references": {"independent_path": "index_select", "rtol": 1e-10, "atol": 1e-10},
  "relations": {
    "selection_gradient_equivalence": {"layer": "property", "generator": "equivalent_masked_and_index_selection", "comparator": "bias_gradients_allclose", "parameters": {"rtol": 1e-10, "atol": 1e-10}, "max_invocations": 4, "mechanisms": ["derivative_error"]},
    "deterministic_repeat": {"layer": "execution", "generator": "repeat_seeded_graph", "comparator": "exact_repeat", "parameters": {}, "max_invocations": 2, "mechanisms": ["repeatability"]},
    "version_pair": {"layer": "replay", "generator": "unchanged_runner_pair", "comparator": "paired_role_semantics", "parameters": {}, "max_invocations": 2, "mechanisms": ["historical_regression", "replay"]}
  },
  "rejection": {"unsupported_backend": "non_evaluable"},
  "provenance": {"upstream_issue": "https://github.com/pytorch/pytorch/issues/99638"}
}
