{
  "schema": "P4-Component-Contract-v1",
  "contract_id": "scipy-solve-banded-representation-v1",
  "component": {"project": "scipy/scipy", "interface": "scipy.linalg.solve_banded", "implementation": "released wheel"},
  "domain": {"inputs": "finite real singleton band systems", "parameters": {"lower_bands": [0, 1], "upper_bands": [0, 1]}},
  "execution": {"deterministic": true, "dtypes": ["float64"], "devices": ["cpu"], "paths": ["conventional", "padded"]},
  "references": {"analytic_solution": true, "rtol": 1e-12, "atol": 1e-12},
  "relations": {
    "reference_solution": {"layer": "reference", "generator": "singleton_diagonal_system", "comparator": "allclose_to_analytic_solution", "parameters": {"rtol": 1e-12, "atol": 1e-12}, "max_invocations": 4, "mechanisms": ["value_error"]},
    "representation_equivalence": {"layer": "property", "generator": "equivalent_band_representations", "comparator": "allclose_between_representations", "parameters": {"rtol": 1e-12, "atol": 1e-12}, "max_invocations": 4, "mechanisms": ["representation_mismatch"]},
    "version_pair": {"layer": "replay", "generator": "unchanged_runner_pair", "comparator": "paired_role_semantics", "parameters": {}, "max_invocations": 2, "mechanisms": ["historical_regression", "replay"]}
  },
  "rejection": {"incompatible_shape": "invalid_case"},
  "provenance": {"upstream_issue": "https://github.com/scipy/scipy/issues/8906"}
}
